{
  "version": 1,
  "scan_id": "4f5d9a8e-2b1c-4c3d-9e8f-7a6b5c4d3e2f",
  "targets": ["127.0.0.1"],
  "ports": [4222, 8000, 8200, 9000],
  "scope": {
    "scope_id": "0b1c2d3e-4f5a-4b6c-8d7e-9f0a1b2c3d4e",
    "cidrs": ["127.0.0.1/32"],
    "expires_at": "2099-01-01T00:00:00Z"
  },
  "limits": {
    "max_concurrency": 4,
    "max_rate_per_sec": 20,
    "connect_timeout_ms": 1000,
    "banner_timeout_ms": 1500
  }
}
